{
  "version": 1,
  "camera": {
    "position": [
      5,
      3.5,
      10
    ],
    "target": [
      0,
      0.9,
      -0.5
    ],
    "fov": 38
  },
  "render": {
    "width": 720,
    "height": 480
  },
  "materials": {
    "floor": {
      "diffuse": [
        0.4,
        0.4,
        0.4
      ],
      "texture": "grid"
    },
    "clear": {
      "diffuse": [
        0,
        0,
        0
      ],
      "transmission": [
        1,
        1,
        1
      ],
      "ior": 1.5
    },
    "mirror": {
      "diffuse": [
        0,
        0,
        0
      ],
      "reflection": [
        0.94,
        0.84,
        0.68
      ]
    },
    "tint": {
      "diffuse": [
        0,
        0,
        0
      ],
      "transmission": [
        0.55,
        0.85,
        1
      ],
      "ior": 1.33
    },
    "orange": {
      "diffuse": [
        0.85,
        0.12,
        0.035
      ],
      "specular": [
        0.2,
        0.2,
        0.2
      ]
    },
    "teal": {
      "diffuse": [
        0.04,
        0.45,
        0.42
      ],
      "specular": [
        0.2,
        0.2,
        0.2
      ]
    }
  },
  "textures": {
    "grid": {
      "kind": "checker",
      "a": [
        0.7,
        0.7,
        0.7
      ],
      "b": [
        0.3,
        0.32,
        0.36
      ],
      "scale": [
        1,
        1
      ]
    }
  },
  "geometries": {
    "plane": {
      "kind": "plane"
    },
    "sphere": {
      "kind": "sphere"
    },
    "cone": {
      "kind": "cone"
    },
    "box": {
      "kind": "box"
    }
  },
  "objects": [
    {
      "name": "floor",
      "geometry": "plane",
      "material": "floor"
    },
    {
      "name": "clear",
      "geometry": "sphere",
      "material": "clear",
      "transform": {
        "translation": [
          -1.25,
          1.05,
          0.25
        ],
        "scale": [
          1.05,
          1.05,
          1.05
        ]
      }
    },
    {
      "name": "mirror",
      "geometry": "sphere",
      "material": "mirror",
      "transform": {
        "translation": [
          1.3,
          1.05,
          0
        ],
        "scale": [
          1.05,
          1.05,
          1.05
        ]
      }
    },
    {
      "name": "tint",
      "geometry": "sphere",
      "material": "tint",
      "transform": {
        "translation": [
          3,
          0.65,
          -1.8
        ],
        "scale": [
          0.65,
          0.65,
          0.65
        ]
      }
    },
    {
      "name": "cone",
      "geometry": "cone",
      "material": "orange",
      "transform": {
        "translation": [
          -2.5,
          1.2,
          -2.4
        ],
        "scale": [
          0.85,
          1.2,
          0.85
        ]
      }
    },
    {
      "name": "box",
      "geometry": "box",
      "material": "teal",
      "transform": {
        "translation": [
          0.1,
          0.8,
          -2.7
        ],
        "scale": [
          0.8,
          0.8,
          0.8
        ]
      }
    }
  ],
  "lights": [
    {
      "kind": "point",
      "position": [
        -3,
        7,
        5
      ],
      "color": [
        1.2,
        1.1,
        0.95
      ]
    },
    {
      "kind": "point",
      "position": [
        5,
        5,
        -2
      ],
      "color": [
        0.2,
        0.3,
        0.5
      ]
    }
  ],
  "background": [
    0.15,
    0.2,
    0.3
  ]
}
