{
  "version": 1,
  "camera": {
    "position": [
      9,
      7,
      11
    ],
    "target": [
      0,
      0,
      0
    ],
    "fov": 45
  },
  "render": {
    "width": 320,
    "height": 224,
    "seed": 116,
    "sampling": "jittered",
    "spp": 16,
    "tile_size": 16,
    "threads": 0
  },
  "materials": {
    "wave": {
      "diffuse": [
        0.03,
        0.4,
        0.35
      ],
      "specular": [
        0.3,
        0.3,
        0.3
      ]
    }
  },
  "geometries": {
    "wave": {
      "kind": "mesh",
      "path": "../assets/benchmark-grid.obj"
    }
  },
  "objects": [
    {
      "name": "wave",
      "geometry": "wave",
      "material": "wave",
      "smooth": true
    }
  ],
  "lights": [
    {
      "kind": "point",
      "position": [
        -4,
        8,
        5
      ],
      "color": [
        1.2,
        1.1,
        1
      ]
    }
  ]
}
