{
  "version": 1,
  "camera": {
    "position": [
      6.8,
      4.2,
      10
    ],
    "target": [
      0,
      1.05,
      0
    ],
    "fov": 34
  },
  "render": {
    "width": 1200,
    "height": 800,
    "spp": 512,
    "seed": 116,
    "integrator": "physical",
    "max_depth": 12,
    "progressive": true,
    "preview_every": 64,
    "exposure": 0.35
  },
  "environment": {
    "kind": "hdr",
    "path": "../assets/studio.hdr",
    "intensity": 0.7,
    "rotation_degrees": 20
  },
  "materials": {
    "gold": {
      "physical": {
        "model": "metal_rough",
        "base_color": [
          0.83,
          0.51,
          0.16
        ],
        "metallic": 1,
        "roughness": 0.32
      }
    },
    "glass": {
      "physical": {
        "model": "dielectric",
        "tint": [
          0.82,
          0.97,
          1
        ],
        "ior": 1.5
      }
    },
    "clay": {
      "physical": {
        "model": "metal_rough",
        "base_color": [
          0.52,
          0.14,
          0.055
        ],
        "metallic": 0,
        "roughness": 0.7
      }
    },
    "ceramic": {
      "physical": {
        "model": "metal_rough",
        "base_color": [
          0.025,
          0.31,
          0.29
        ],
        "metallic": 0,
        "roughness": 0.4
      }
    },
    "slate": {
      "physical": {
        "model": "metal_rough",
        "base_color": [
          0.085,
          0.115,
          0.145
        ],
        "metallic": 0,
        "roughness": 0.65
      }
    },
    "floor": {
      "physical": {
        "model": "diffuse",
        "base_color": [
          0.3,
          0.34,
          0.38
        ]
      }
    }
  },
  "geometries": {
    "ring": {
      "kind": "mesh",
      "path": "../assets/torus.obj"
    },
    "faceted": {
      "kind": "mesh",
      "path": "../assets/uv-sphere.obj"
    },
    "sphere": {
      "kind": "sphere"
    },
    "cylinder": {
      "kind": "cylinder"
    },
    "box": {
      "kind": "box"
    },
    "plane": {
      "kind": "plane"
    }
  },
  "objects": [
    {
      "name": "floor",
      "geometry": "plane",
      "material": "floor",
      "transform": {
        "translation": [
          0,
          0,
          0
        ],
        "scale": [
          1,
          1,
          1
        ],
        "rotation_degrees": [
          0,
          0,
          0
        ]
      },
      "smooth": false
    },
    {
      "name": "slate-plinth",
      "geometry": "box",
      "material": "slate",
      "transform": {
        "translation": [
          0,
          0.16,
          0
        ],
        "scale": [
          3,
          0.16,
          1.85
        ],
        "rotation_degrees": [
          0,
          0,
          0
        ]
      },
      "smooth": false
    },
    {
      "name": "gold-arch",
      "geometry": "ring",
      "material": "gold",
      "transform": {
        "translation": [
          -0.9,
          1.92,
          -0.3
        ],
        "scale": [
          1.28,
          1.28,
          1.28
        ],
        "rotation_degrees": [
          90,
          -12,
          0
        ]
      },
      "smooth": true
    },
    {
      "name": "clear-form",
      "geometry": "sphere",
      "material": "glass",
      "transform": {
        "translation": [
          0.85,
          1.13,
          0.85
        ],
        "scale": [
          0.81,
          0.81,
          0.81
        ],
        "rotation_degrees": [
          0,
          0,
          0
        ]
      },
      "smooth": false
    },
    {
      "name": "clay-column",
      "geometry": "cylinder",
      "material": "clay",
      "transform": {
        "translation": [
          1.65,
          0.92,
          -0.8
        ],
        "scale": [
          0.52,
          0.6,
          0.52
        ],
        "rotation_degrees": [
          0,
          0,
          0
        ]
      },
      "smooth": false
    },
    {
      "name": "teal-gem",
      "geometry": "faceted",
      "material": "ceramic",
      "transform": {
        "translation": [
          -1.95,
          0.77,
          0.95
        ],
        "scale": [
          0.45,
          0.45,
          0.45
        ],
        "rotation_degrees": [
          0,
          0,
          0
        ]
      },
      "smooth": false
    },
    {
      "name": "small-orb",
      "geometry": "sphere",
      "material": "ceramic",
      "transform": {
        "translation": [
          0.3,
          0.62,
          -0.9
        ],
        "scale": [
          0.3,
          0.3,
          0.3
        ],
        "rotation_degrees": [
          0,
          0,
          0
        ]
      },
      "smooth": false
    }
  ],
  "lights": [
    {
      "kind": "area",
      "center": [
        -3,
        6,
        5
      ],
      "edge_u": [
        3,
        0,
        0
      ],
      "edge_v": [
        0,
        0,
        3
      ],
      "radiance": [
        7,
        6,
        4.5
      ]
    }
  ]
}
